{
  "event_type": "intake.normalized",
  "event_id": "c1d2e3f4-0001-4000-8000-000000000001",
  "timestamp": "2026-04-06T16:26:01.123Z",
  "source": "worker-etl",
  "correlation_id": "0bdc6665-ed66-4a37-ae4d-07306ea2b1f4",
  "causation_id": "74962918-100c-4b32-b85d-43d08ca356c1",
  "version": "1.0.0",
  "retry_count": 0,
  "payload": {
    "db_columns": {
      "cluster_id": "e7f8a9b0-1234-4000-8000-abcdef012345",
      "generated_name": "opl-a7f3b2",
      "cluster_name": "acme-fsi-demo",
      "cloud_provider": "aws",
      "state": "Pending",
      "company_name": "Acme Corp",
      "primary_first": "Jane",
      "primary_last": "Smith",
      "primary_email": "jane.smith@acme.com",
      "secondary_first": "Bob",
      "secondary_last": "Jones",
      "secondary_email": "bob.jones@acme.com",
      "sponsor": "sponsor@redhat.com",
      "project_name": "fsi-demo",
      "request_type": "OpenShift",
      "openshift_version": "4.17",
      "description": "Evaluating OpenShift for our financial services workloads.",
      "notes": "",
      "cluster_size": "Standard",
      "start_date": "2026-04-14T04:00:00+00:00",
      "end_date": "2026-05-05T04:00:00+00:00",
      "lease_time": "3 weeks (15 working days)",
      "region": "America/New_York",
      "partner": false,
      "always_on": false,
      "hold": false,
      "request_id": "a40b69d2-947c-4481-9fe4-523e3fa53a6a"
    },
    "extras": {
      "is_extension": "New Request",
      "statement_of_work": "",
      "application_type": "",
      "deployment_option": "",
      "virt_size": "",
      "ai_deployment_option": "",
      "ai_size": "",
      "gpu_required": "",
      "extension_challenges": "",
      "extension_objectives": ""
    },
    "is_standard_config": true
  }
}
