{
  "event_type": "intake.raw",
  "event_id": "74962918-100c-4b32-b85d-43d08ca356c1",
  "timestamp": "2026-04-06T16:25:57.806Z",
  "source": "appscript-intake",
  "correlation_id": "0bdc6665-ed66-4a37-ae4d-07306ea2b1f4",
  "causation_id": null,
  "version": "1.0.0",
  "retry_count": 0,
  "payload_type": "google-sheets-v1",
  "payload": {
    "form_response_id": "a40b69d2-947c-4481-9fe4-523e3fa53a6a",
    "sheet_row_number": 42,
    "sheet_row": {
      "request_id": "a40b69d2-947c-4481-9fe4-523e3fa53a6a",
      "timestamp": "2026-04-06T14:01:15.275Z",
      "email": "sponsor@redhat.com",
      "status": "Submitted",
      "evaluated_on": "2026-04-06T16:25:52.279Z",
      "company_name": "Acme Corp",
      "primary_contact_name": "Jane Smith",
      "primary_contact_email": "jane.smith@acme.com",
      "secondary_contact_name": "Bob Jones",
      "secondary_contact_email": "bob.jones@acme.com",
      "sponsor": "sponsor@redhat.com",
      "start_date": "2026-04-14T04:00:00.000Z",
      "lease": "3 weeks (15 working days)",
      "timezone": "America/New_York",
      "is_extension": "New Request",
      "project_name": "fsi-demo",
      "openshift_version": "4.17",
      "request_type": "OpenShift",
      "description": "Evaluating OpenShift for our financial services workloads.",
      "statement_of_work": "",
      "application_type": "",
      "deployment_option": "",
      "cluster_size": "Standard",
      "virt_size": "",
      "ai_deployment_option": "",
      "ai_size": "",
      "gpu_required": "",
      "note": "",
      "extension_challenges": "",
      "extension_objectives": ""
    }
  }
}
